{
  "course": {
    "title": "725103 Data Structure and Algorithm",
    "term": "ภาคปลาย ปีการศึกษา 2568 (1 พ.ย. 2568 – 1 มี.ค. 2569)",
    "schedule": "เวลาเรียน: (ใส่วัน-เวลาเรียนที่นี่)",
    "room": "(ใส่ห้องเรียนที่นี่)",
    "description": "โครงสร้างข้อมูลแบบต่างๆ ทั้งแบบเชิงเส้น อะเรย์ ลิงค์ลิสต์ แสตกคิวและแบบไม่ใช่เชิงเส้น ทรี กราฟ อัลกอริทึมพื้นฐานที่ใช้กับโครงสร้างข้อมูล เทคนิคการเรียงลำดับข้อมูลในหน่วยความจำหลักแบบต่างๆ ค้นหาข้อมูล การพัฒนาอัลกอริทึมและการวิเคราะห์อัลกอริทึมอย่างง่าย และการเขียนโปรแกรมเพื่อจัดการกับโครงสร้างแบบต่างๆ"
  },
  "clos": [
    {
      "id": "CLO1",
      "description": "อธิบายแนวคิดพื้นฐานของ data, data structure, algorithm, memory model และแนวคิด Abstract Data Type (ADT) พร้อมยกตัวอย่างการใช้งานได้",
      "bloom": "Understand",
      "type": "K"
    },
    {
      "id": "CLO2",
      "description": "อ่าน/เขียน pseudocode ระดับพื้นฐาน และ trace ขั้นตอนการทำงานด้วยแผนภาพหรือการไล่ค่าตัวแปรได้อย่างถูกต้อง",
      "bloom": "Apply",
      "type": "S"
    },
    {
      "id": "CLO3",
      "description": "วิเคราะห์ประสิทธิภาพเชิงเวลา/หน่วยความจำของอัลกอริทึมในระดับ Big-O และแยก best/worst case ของตัวอย่างมาตรฐานได้",
      "bloom": "Analyze",
      "type": "K"
    },
    {
      "id": "CLO4",
      "description": "เลือกใช้และอธิบาย trade-off ของโครงสร้างข้อมูล (array, linked list, stack, queue, tree, heap, hash table, graph) ให้เหมาะกับโจทย์ และให้เหตุผลเชิงประสิทธิภาพได้",
      "bloom": "Analyze",
      "type": "S"
    },
    {
      "id": "CLO5",
      "description": "สื่อสารแนวคิดและคำตอบอย่างเป็นระบบ ทำงานร่วมกันอย่างรับผิดชอบ และปฏิบัติตามความซื่อสัตย์ทางวิชาการ",
      "bloom": "Evaluate",
      "type": "A"
    }
  ],
  "plos": ["PLO1", "PLO2", "PLO3", "PLO4", "PLO5", "PLO6"],
  "mapping": [
    { "clo": "CLO1", "weights": [1, 3, 2, 1, 1, 2] },
    { "clo": "CLO2", "weights": [1, 2, 3, 1, 2, 3] },
    { "clo": "CLO3", "weights": [1, 2, 3, 1, 1, 3] },
    { "clo": "CLO4", "weights": [1, 3, 3, 2, 2, 3] },
    { "clo": "CLO5", "weights": [3, 1, 2, 3, 3, 1] }
  ],
  "assessments": [
    {
      "tool": "พฤติกรรมเข้าเรียน/ส่งงาน/การมีส่วนร่วม",
      "weight": "10%",
      "clos": ["CLO5"],
      "threshold": "≥ 60%",
      "analysis": "เช็คชื่อ + checklist การมีส่วนร่วม + สรุปผลรายสัปดาห์"
    },
    {
      "tool": "งานเดี่ยว/ใบงานท้ายบท (Worksheet)",
      "weight": "10%",
      "clos": ["CLO1", "CLO2", "CLO3", "CLO4"],
      "threshold": "≥ 60%",
      "analysis": "Rubric แบบสั้น (ถูกต้อง/เหตุผล/การสื่อสาร) + สรุปข้อผิดพลาดที่พบบ่อย"
    },
    {
      "tool": "สอบย่อย (Quiz)",
      "weight": "15%",
      "clos": ["CLO1", "CLO2", "CLO3"],
      "threshold": "≥ 60%",
      "analysis": "Item analysis (ง่าย/ยาก) + ปรับการสอนตามหัวข้อที่ตกหล่น"
    },
    {
      "tool": "งานกลุ่ม (Group assignment / mini project)",
      "weight": "15%",
      "clos": ["CLO4", "CLO5"],
      "threshold": "≥ 60%",
      "analysis": "Rubric (ความเหมาะสมของ DS/Algorithm + เหตุผล + การนำเสนอ/รายงาน)"
    },
    {
      "tool": "สอบกลางภาค (Midterm exam)",
      "weight": "20%",
      "clos": ["CLO1", "CLO2", "CLO3"],
      "threshold": "≥ 50%",
      "analysis": "แยกคะแนนตาม CLO + วิเคราะห์หัวข้อที่ต้อง remedial"
    },
    {
      "tool": "สอบปลายภาค (Final exam)",
      "weight": "30%",
      "clos": ["CLO2", "CLO3", "CLO4"],
      "threshold": "≥ 50%",
      "analysis": "แยกคะแนนตาม CLO + สรุปผลการบรรลุ CLO รายภาพรวมรายวิชา"
    }
  ],
  "schedule": [
    {
      "week": "สัปดาห์ที่ 1",
      "date": "(ใส่วันที่)",
      "topic": "Introduction • Data Structures • Data in Memory • Abstract Data Type (ADT)",
      "notes": "วันนี้เราจะเริ่มจากคำถามว่า “ทำไมต้องมี Data Structures” แล้วค่อย ๆ เปิดภาพว่าข้อมูลอยู่ในหน่วยความจำอย่างไร ก่อนปิดท้ายด้วยแนวคิด ADT ที่ทำให้เราแยก “สิ่งที่ทำได้” ออกจาก “วิธีทำ”",
      "materials": [
        { "label": "Slides Week 1", "href": "../assets/handout/725103/week01_slides.pdf" },
        { "label": "Worksheet Week 1", "href": "../assets/latex/ds_week_material/week1/week1_mat.pdf" }
      ]
    },
    {
      "week": "สัปดาห์ที่ 2",
      "date": "(ใส่วันที่)",
      "topic": "Pseudocode • Asymptotic Notation • Best/Worst Case",
      "notes": "เราจะเริ่ม “อ่านภาษาอัลกอริทึม” ด้วย pseudocode และเรียนรู้วิธีพูดเรื่องความเร็ว/การเติบโตของเวลาแบบไม่ติดตัวเลขเครื่องจริง ด้วย Big-O พร้อมรู้จัก best/worst case",
      "materials": [
        { "label": "Slides Week 2", "href": "../assets/handout/725103/week02_slides.pdf" }
      ]
    },
    {
      "week": "สัปดาห์ที่ 3",
      "date": "(ใส่วันที่)",
      "topic": "Arrays • Sequential Organization • Binary Search",
      "notes": "วันนี้เราจะเห็นพลังของการเก็บข้อมูลแบบ “เรียงเป็นช่อง ๆ” ใน array ที่เข้าถึงเร็วมาก แล้วใช้เงื่อนไข “ข้อมูลต้องเรียง” เพื่อทำ Binary Search แบบเร็วขึ้นอย่างชัดเจน",
      "materials": [
        { "label": "Slides Week 3", "href": "../assets/handout/725103/week03_slides.pdf" }
      ]
    },
    {
      "week": "สัปดาห์ที่ 4",
      "date": "(ใส่วันที่)",
      "topic": "Dynamic Arrays • List • Singly Linked List",
      "notes": "เมื่อ array โตไม่ทันใจ เราต้องรู้จัก dynamic array และเมื่อการแทรก/ลบกลายเป็นปัญหา เราจะเปิดโลก linked list ที่เชื่อมกันด้วย pointer (แบบเข้าใจจากภาพ ไม่ต้องโค้ดจริง)",
      "materials": [
        { "label": "Slides Week 4", "href": "../assets/handout/725103/week04_slides.pdf" }
      ]
    },
    {
      "week": "สัปดาห์ที่ 5",
      "date": "(ใส่วันที่)",
      "topic": "Doubly Linked List • Circular Doubly Linked List",
      "notes": "วันนี้เราจะเพิ่ม “ทางกลับ” ให้ linked list ด้วย prev และต่อยอดเป็นแบบ “วงกลม” เพื่อจัดการงานที่วนซ้ำได้สะดวก แต่ต้องระวังกรณีขอบให้ดี",
      "materials": [
        { "label": "Slides Week 5", "href": "../assets/handout/725103/week05_slides.pdf" }
      ]
    },
    {
      "week": "สัปดาห์ที่ 6",
      "date": "(ใส่วันที่)",
      "topic": "Stack • Queue • Implementations • Expression Evaluation",
      "notes": "เราจะได้โครงสร้างที่เหมือน “กองจาน” (stack) และ “แถวต่อคิว” (queue) แล้วนำ stack ไปใช้แก้ปัญหานิพจน์คณิตฯ แบบจับต้องได้ (trace ทีละสเต็ปจนเห็นคำตอบ)",
      "materials": [
        { "label": "Slides Week 6", "href": "../assets/handout/725103/week06_slides.pdf" }
      ]
    },
    {
      "week": "สัปดาห์ที่ 7",
      "date": "(ใส่วันที่)",
      "topic": "Recursion • Divide-and-Conquer • Efficiency of Recursion",
      "notes": "วันนี้เราจะเรียนวิธีคิดแบบ “เรียกตัวเองให้เล็กลง” (recursion) พร้อมมองภาพ call stack และรู้จัก divide-and-conquer จากตัวอย่างง่าย ๆ ก่อนเริ่มแตะการวิเคราะห์เวลาแบบคร่าว ๆ",
      "materials": [
        { "label": "Slides Week 7", "href": "../assets/handout/725103/week07_slides.pdf" }
      ]
    },
    {
      "week": "สัปดาห์ที่ 8",
      "date": "(ใส่วันที่)",
      "topic": "Midterm Exam",
      "notes": "สอบกลางภาค",
      "materials": []
    },
    {
      "week": "สัปดาห์ที่ 9",
      "date": "(ใส่วันที่)",
      "topic": "Trees • Binary Tree • BFS/DFS Traversal",
      "notes": "หลัง midterm เราจะเปิดโลก “โครงสร้างแบบลำดับชั้น” (tree) เรียนคำศัพท์สำคัญ และฝึก “เดินต้นไม้” แบบ BFS/DFS จนเห็นว่าแต่ละแบบให้ลำดับต่างกันอย่างไร",
      "materials": [
        { "label": "Slides Week 9", "href": "../assets/handout/725103/week09_slides.pdf" }
      ]
    },
    {
      "week": "สัปดาห์ที่ 10",
      "date": "(ใส่วันที่)",
      "topic": "Tree Representation • Binary Search Tree (BST) • Insert/Delete",
      "notes": "เราจะทำให้ BST เป็น “แผนที่การค้นหา” ที่เร็วขึ้นด้วยกฎการจัดวาง และฝึกเคสลบที่มักสับสน (ลบใบ/มีลูกหนึ่ง/มีลูกสอง) ด้วยการ trace แบบเป็นขั้นตอน",
      "materials": [
        { "label": "Slides Week 10", "href": "../assets/handout/725103/week10_slides.pdf" }
      ]
    },
    {
      "week": "สัปดาห์ที่ 11",
      "date": "(ใส่วันที่)",
      "topic": "Tries (Prefix Trees) • Prefix Matching",
      "notes": "เราจะเห็นโครงสร้างที่เหมาะกับ “ค้นหาตามคำนำหน้า” เช่นคำศัพท์/ชื่อ/รหัสสินค้า ด้วย trie ที่ทำให้การค้นหาขึ้นกับ “ความยาวคำ” มากกว่าจำนวนคำทั้งหมด",
      "materials": [
        { "label": "Slides Week 11", "href": "../assets/handout/725103/week11_slides.pdf" }
      ]
    },
    {
      "week": "สัปดาห์ที่ 12",
      "date": "(ใส่วันที่)",
      "topic": "Priority Queue • Heaps • Heap Sort",
      "notes": "วันนี้เราจะเรียนการจัดคิวแบบ “มาก่อนไม่สำคัญเท่าความสำคัญ” ด้วย priority queue และทำให้ทำงานได้มีประสิทธิภาพด้วย heap ก่อนปิดท้ายด้วย Heap Sort",
      "materials": [
        { "label": "Slides Week 12", "href": "../assets/handout/725103/week12_slides.pdf" }
      ]
    },
    {
      "week": "สัปดาห์ที่ 13",
      "date": "(ใส่วันที่)",
      "topic": "Hash Table • Hash Function • Collision (concept)",
      "notes": "เราจะรู้จักแนวคิด “ค้นหาเหมือนเปิดลิ้นชักด้วยกุญแจ (key)” ผ่าน hash table และเรียนว่า hash function ที่ดีควรมีคุณสมบัติอย่างไร รวมถึงรับมือปัญหา key ชนกัน (collision)",
      "materials": [
        { "label": "Slides Week 13", "href": "../assets/handout/725103/week13_slides.pdf" }
      ]
    },
    {
      "week": "สัปดาห์ที่ 14",
      "date": "(ใส่วันที่)",
      "topic": "Graphs • Traversal • Shortest Path • MST (concept)",
      "notes": "เราจะใช้ graph แทน “โลกของความเชื่อมโยง” เช่น แผนที่/เครือข่าย/ความสัมพันธ์ แล้วเรียนทั้งการท่องกราฟ (BFS/DFS) และแนวคิดสำคัญอย่าง shortest path กับ MST จากตัวอย่างเล็ก ๆ",
      "materials": [
        { "label": "Slides Week 14", "href": "../assets/handout/725103/week14_slides.pdf" }
      ]
    },
    {
      "week": "สัปดาห์ที่ 15",
      "date": "(ใส่วันที่)",
      "topic": "Searching & Sorting • Complexity Trade-offs",
      "notes": "เราจะปิดเนื้อหาหลักด้วยคลังเครื่องมือ “ค้นหาและเรียงลำดับ” เพื่อให้เลือกใช้ได้เหมาะกับสถานการณ์ พร้อมฝึกดู Big-O และ trade-off แบบที่อธิบายได้เป็นเหตุเป็นผล",
      "materials": [
        { "label": "Slides Week 15", "href": "../assets/handout/725103/week15_slides.pdf" }
      ]
    },
    {
      "week": "สัปดาห์ที่ 16",
      "date": "(ใส่วันที่)",
      "topic": "Review • Mock Quiz • Final Preparation",